{
  "artifacts": [
    {
      "architecture": "aarch64",
      "build": {
        "checkout_prefix": "/home/runner/work/testbins/testbins",
        "compiler": "aarch64-linux-gnu-gnatmake-13",
        "compiler_flags": [
          "-q",
          "-gnat2022",
          "-O0",
          "-cargs",
          "-fexceptions",
          "-g0",
          "-ffile-prefix-map=/home/runner/work/testbins/testbins=/testbins"
        ],
        "environment": {
          "LC_ALL": "C",
          "SOURCE_DATE_EPOCH": "1704067200",
          "TZ": "UTC"
        },
        "path_strategy": "compiler-prefix-map",
        "runner_arch": "x64",
        "runner_image": "ubuntu24-20260810.271.1",
        "runner_os": "linux",
        "source": "sources/ada-d-eh/ada_eh_probe.adb",
        "working_directory": "/testbins"
      },
      "evidence": {
        "checkout_path_absent": true,
        "eh_frame_present": true,
        "require_unwind_tables": true,
        "required_sections": [
          ".eh_frame",
          ".gcc_except_table"
        ],
        "required_strings": [
          "ada-d-eh probe passed",
          "constraint",
          "decode",
          "secondary"
        ],
        "required_symbols": [
          "__gnat_personality_v0"
        ]
      },
      "exception_model": "itanium-dwarf",
      "execution": "not-run-cross-target",
      "neverd": {
        "corpus_proven": true,
        "descriptor_abi": "gnat-exception-id",
        "min_call_sites": 1,
        "min_catch_clauses": 3,
        "min_cleanup_pads": 0,
        "min_landing_pads": 1,
        "min_type_table_entries": 3,
        "native_reconstruction": "address-clauses",
        "personalities_any": [
          "__gnat_personality_v0"
        ],
        "type_table_interpretation": "opaque-descriptor",
        "validation_level": "lsda-graph"
      },
      "object_format": "elf",
      "optimization": "o0",
      "path": "corpus/ada-d-eh/ada/gnat/aarch64-linux-gnu/o0/ada_eh_probe-gnat-aarch64-linux-gnu-o0",
      "sha256": "bbe628d9bdbb71cf33028feae70884becbd7df9b6d5f3f465496f71e7d7f7088",
      "size": 83904,
      "source_language": "ada",
      "target": "aarch64-linux-gnu",
      "toolchain": "gnat",
      "toolchain_version": "13.3.0"
    },
    {
      "architecture": "aarch64",
      "build": {
        "checkout_prefix": "/home/runner/work/testbins/testbins",
        "compiler": "aarch64-linux-gnu-gnatmake-13",
        "compiler_flags": [
          "-q",
          "-gnat2022",
          "-O2",
          "-cargs",
          "-fexceptions",
          "-g0",
          "-ffile-prefix-map=/home/runner/work/testbins/testbins=/testbins"
        ],
        "environment": {
          "LC_ALL": "C",
          "SOURCE_DATE_EPOCH": "1704067200",
          "TZ": "UTC"
        },
        "path_strategy": "compiler-prefix-map",
        "runner_arch": "x64",
        "runner_image": "ubuntu24-20260810.271.1",
        "runner_os": "linux",
        "source": "sources/ada-d-eh/ada_eh_probe.adb",
        "working_directory": "/testbins"
      },
      "evidence": {
        "checkout_path_absent": true,
        "eh_frame_present": true,
        "require_unwind_tables": true,
        "required_sections": [
          ".eh_frame",
          ".gcc_except_table"
        ],
        "required_strings": [
          "ada-d-eh probe passed",
          "constraint",
          "decode",
          "secondary"
        ],
        "required_symbols": [
          "__gnat_personality_v0"
        ]
      },
      "exception_model": "itanium-dwarf",
      "execution": "not-run-cross-target",
      "neverd": {
        "corpus_proven": true,
        "descriptor_abi": "gnat-exception-id",
        "min_call_sites": 1,
        "min_catch_clauses": 3,
        "min_cleanup_pads": 0,
        "min_landing_pads": 1,
        "min_type_table_entries": 3,
        "native_reconstruction": "address-clauses",
        "personalities_any": [
          "__gnat_personality_v0"
        ],
        "type_table_interpretation": "opaque-descriptor",
        "validation_level": "lsda-graph"
      },
      "object_format": "elf",
      "optimization": "o2",
      "path": "corpus/ada-d-eh/ada/gnat/aarch64-linux-gnu/o2/ada_eh_probe-gnat-aarch64-linux-gnu-o2",
      "sha256": "6e0529872d1de96a73b09e7b96ee2dd1fbe837f76dedfda7393b69fa06028247",
      "size": 83736,
      "source_language": "ada",
      "target": "aarch64-linux-gnu",
      "toolchain": "gnat",
      "toolchain_version": "13.3.0"
    },
    {
      "architecture": "x86_64",
      "build": {
        "checkout_prefix": "/home/runner/work/testbins/testbins",
        "compiler": "gnatmake-13",
        "compiler_flags": [
          "-q",
          "-gnat2022",
          "-O0",
          "-cargs",
          "-fexceptions",
          "-g0",
          "-ffile-prefix-map=/home/runner/work/testbins/testbins=/testbins"
        ],
        "environment": {
          "LC_ALL": "C",
          "SOURCE_DATE_EPOCH": "1704067200",
          "TZ": "UTC"
        },
        "path_strategy": "compiler-prefix-map",
        "runner_arch": "x64",
        "runner_image": "ubuntu24-20260810.271.1",
        "runner_os": "linux",
        "source": "sources/ada-d-eh/ada_eh_probe.adb",
        "working_directory": "/testbins"
      },
      "evidence": {
        "checkout_path_absent": true,
        "eh_frame_present": true,
        "require_unwind_tables": true,
        "required_sections": [
          ".eh_frame",
          ".gcc_except_table"
        ],
        "required_strings": [
          "ada-d-eh probe passed",
          "constraint",
          "decode",
          "secondary"
        ],
        "required_symbols": [
          "__gnat_personality_v0"
        ]
      },
      "exception_model": "itanium-dwarf",
      "execution": "passed",
      "neverd": {
        "corpus_proven": true,
        "descriptor_abi": "gnat-exception-id",
        "min_call_sites": 1,
        "min_catch_clauses": 3,
        "min_cleanup_pads": 0,
        "min_landing_pads": 1,
        "min_type_table_entries": 3,
        "native_reconstruction": "address-clauses",
        "personalities_any": [
          "__gnat_personality_v0"
        ],
        "type_table_interpretation": "opaque-descriptor",
        "validation_level": "lsda-graph"
      },
      "object_format": "elf",
      "optimization": "o0",
      "path": "corpus/ada-d-eh/ada/gnat/x86_64-linux-gnu/o0/ada_eh_probe-gnat-x86_64-linux-gnu-o0",
      "sha256": "1fd47fa5258889c3e54140851f74c6f026172887b7a581f604c29fd70d6d86d7",
      "size": 36952,
      "source_language": "ada",
      "target": "x86_64-linux-gnu",
      "toolchain": "gnat",
      "toolchain_version": "13.3.0"
    },
    {
      "architecture": "x86_64",
      "build": {
        "checkout_prefix": "/home/runner/work/testbins/testbins",
        "compiler": "gnatmake-13",
        "compiler_flags": [
          "-q",
          "-gnat2022",
          "-O2",
          "-cargs",
          "-fexceptions",
          "-g0",
          "-ffile-prefix-map=/home/runner/work/testbins/testbins=/testbins"
        ],
        "environment": {
          "LC_ALL": "C",
          "SOURCE_DATE_EPOCH": "1704067200",
          "TZ": "UTC"
        },
        "path_strategy": "compiler-prefix-map",
        "runner_arch": "x64",
        "runner_image": "ubuntu24-20260810.271.1",
        "runner_os": "linux",
        "source": "sources/ada-d-eh/ada_eh_probe.adb",
        "working_directory": "/testbins"
      },
      "evidence": {
        "checkout_path_absent": true,
        "eh_frame_present": true,
        "require_unwind_tables": true,
        "required_sections": [
          ".eh_frame",
          ".gcc_except_table"
        ],
        "required_strings": [
          "ada-d-eh probe passed",
          "constraint",
          "decode",
          "secondary"
        ],
        "required_symbols": [
          "__gnat_personality_v0"
        ]
      },
      "exception_model": "itanium-dwarf",
      "execution": "passed",
      "neverd": {
        "corpus_proven": true,
        "descriptor_abi": "gnat-exception-id",
        "min_call_sites": 1,
        "min_catch_clauses": 3,
        "min_cleanup_pads": 0,
        "min_landing_pads": 1,
        "min_type_table_entries": 3,
        "native_reconstruction": "address-clauses",
        "personalities_any": [
          "__gnat_personality_v0"
        ],
        "type_table_interpretation": "opaque-descriptor",
        "validation_level": "lsda-graph"
      },
      "object_format": "elf",
      "optimization": "o2",
      "path": "corpus/ada-d-eh/ada/gnat/x86_64-linux-gnu/o2/ada_eh_probe-gnat-x86_64-linux-gnu-o2",
      "sha256": "5af8311e69d0626e4bd7e4cc6391c56811cb3590dbbb69f03a81d6b6c83cb5d9",
      "size": 36800,
      "source_language": "ada",
      "target": "x86_64-linux-gnu",
      "toolchain": "gnat",
      "toolchain_version": "13.3.0"
    },
    {
      "architecture": "x86_64",
      "build": {
        "checkout_prefix": "/home/runner/work/testbins/testbins",
        "compiler": "dmd",
        "compiler_flags": [
          "-m64",
          "-fPIE"
        ],
        "environment": {
          "LC_ALL": "C",
          "SOURCE_DATE_EPOCH": "1704067200",
          "TZ": "UTC"
        },
        "path_strategy": "relative-source-no-debug",
        "runner_arch": "x64",
        "runner_image": "ubuntu24-20260810.271.1",
        "runner_os": "linux",
        "source": "sources/ada-d-eh/d_eh_probe.d",
        "working_directory": "/testbins"
      },
      "evidence": {
        "checkout_path_absent": true,
        "eh_frame_present": true,
        "require_unwind_tables": true,
        "required_sections": [
          ".eh_frame",
          ".gcc_except_table"
        ],
        "required_strings": [
          "ada-d-eh probe passed",
          "constraint",
          "decode",
          "secondary"
        ],
        "required_symbols": [
          "__dmd_personality_v0"
        ]
      },
      "exception_model": "itanium-dwarf",